{"mapping_sha256":"4A5AF4C151672BE09E0795DC04270DC9BD558711FCF3838E1ACF16C9AF92B290","scene_id":"scene_999999","schema_version":"fourgraph.variable_map.v1","variables":[{"canonical_id":"X000","public_name":"Treatment","variable_type":"binary"},{"canonical_id":"X001","public_name":"Mediator","variable_type":"continuous"},{"canonical_id":"X002","public_name":"Outcome","variable_type":"continuous"}]}
